{
  "scenario": "E2E-09",
  "name": "micro_stream_receiver",
  "status": "pass",
  "server": {
    "type": "michi-micro-server",
    "version": "0.1.0"
  },
  "client": {
    "type": "michi-music-stream-simulator",
    "version": "0.1.0"
  },
  "timestamp": "2026-08-14T22:15:26Z",
  "checks": [
    {
      "name": "discovery_signed_announce",
      "status": "pass",
      "detail": "dynamic announce: bundle schema valid; michi_id = base64url(BLAKE3(public_key)) coherent; Ed25519 signature verifies over the canonical bytes; accepted (accepted); replay of (michi_id, nonce) rejected; altered signature rejected; tampered nonce rejected (signature mismatch); stale timestamp rejected (outside the +-90 s window); michi_id/public_key mismatch rejected; bundle vector: schema/signature/identity hold; freshness rejects the stale timestamp"
    },
    {
      "name": "server_info",
      "status": "pass",
      "detail": "HTTP 200; service=michi-stream-standard; api_version=v1-lite; identity_scheme=ed25519-blake3-v1; auth.strategy=RECEIVER_BUTTON; auth.token_refresh=False; features.session=True; features.heartbeat=True; features.volume=True; michi_id coherent"
    },
    {
      "name": "pairing_window_open",
      "status": "pass",
      "detail": "physical pairing window opened via the simulator internal hook (state.open_pairing_window)"
    },
    {
      "name": "controller_identity",
      "status": "pass",
      "detail": "fresh Ed25519 identity (michi_id=RizfxtW_...); challenge signature verifies over the decoded nonce"
    },
    {
      "name": "random_ssrc",
      "status": "pass",
      "detail": "ssrc = 1934812923 (dynamic)"
    },
    {
      "name": "pair_start",
      "status": "pass",
      "detail": "HTTP 201; attempts_remaining=5; michi_id coherent"
    },
    {
      "name": "pair_status_pending",
      "status": "pass",
      "detail": "HTTP 200; status=pending"
    },
    {
      "name": "read_pairing_pin_local_display",
      "status": "pass",
      "detail": "dynamic PIN read from the local display channel (7*****)"
    },
    {
      "name": "pair_confirm",
      "status": "pass",
      "detail": "HTTP 200; expires_in=0"
    },
    {
      "name": "pair_confirm_replay_rejected",
      "status": "pass",
      "detail": "HTTP 409; error.code=PAIRING_ALREADY_CONSUMED"
    },
    {
      "name": "pair_status_confirmed",
      "status": "pass",
      "detail": "HTTP 200; status=confirmed"
    },
    {
      "name": "session_create",
      "status": "pass",
      "detail": "HTTP 201; lease_seconds=30; effective.ssrc=1934812923; effective.stream_port=57397 (in [49152, 65535])"
    },
    {
      "name": "session_create_source_ip_rejected",
      "status": "pass",
      "detail": "HTTP 400; error.code=INVALID_REQUEST; error.details.field=body"
    },
    {
      "name": "session_create_wrong_payload_type_rejected",
      "status": "pass",
      "detail": "HTTP 400; error.code=INVALID_REQUEST; error.details.field=payload_type"
    },
    {
      "name": "session_create_zero_ssrc_rejected",
      "status": "pass",
      "detail": "HTTP 400; error.code=INVALID_REQUEST; error.details.field=ssrc"
    },
    {
      "name": "rtp_100_packets",
      "status": "pass",
      "detail": "sent 100 RTP datagrams (PT 97, SSRC 1934812923, 1920 B payload) over real UDP to 127.0.0.1:57397; all 100 arrived canonical at the bound socket"
    },
    {
      "name": "rtp_guard_rejection_classes",
      "status": "pass",
      "detail": "shared firmware rtp_guard.c host test: source-IP/PT/SSRC/size rejection classes verified (the same source the firmware engine runs)"
    },
    {
      "name": "heartbeat_tick",
      "status": "pass",
      "detail": "dynamic epoch-milliseconds captured"
    },
    {
      "name": "heartbeat_ok",
      "status": "pass",
      "detail": "HTTP 200; status=alive; lease_seconds=30"
    },
    {
      "name": "heartbeat_replay_rejected",
      "status": "pass",
      "detail": "HTTP 409; error.code=CONFLICT"
    },
    {
      "name": "heartbeat_tick_2",
      "status": "pass",
      "detail": "dynamic epoch-milliseconds captured"
    },
    {
      "name": "heartbeat_seq2_ok",
      "status": "pass",
      "detail": "HTTP 200; status=alive"
    },
    {
      "name": "patch_volume",
      "status": "pass",
      "detail": "HTTP 200; volume=55; state=playing; paused=False"
    },
    {
      "name": "patch_pause",
      "status": "pass",
      "detail": "HTTP 200; state=paused; paused=True"
    },
    {
      "name": "patch_resume",
      "status": "pass",
      "detail": "HTTP 200; state=playing; paused=False"
    },
    {
      "name": "session_get_state",
      "status": "pass",
      "detail": "HTTP 200; volume=55; state=playing; paused=False; stream_port=57397; ssrc=1934812923"
    },
    {
      "name": "session_delete",
      "status": "pass",
      "detail": "HTTP 204"
    },
    {
      "name": "session_get_after_delete",
      "status": "pass",
      "detail": "HTTP 404; error.code=NOT_FOUND"
    },
    {
      "name": "session_create_after_delete",
      "status": "pass",
      "detail": "HTTP 201"
    },
    {
      "name": "lease_expire",
      "status": "pass",
      "detail": "simulator mono clock advanced 31 s (lease expires without heartbeat)"
    },
    {
      "name": "session_get_after_lease_expiry",
      "status": "pass",
      "detail": "HTTP 404; error.code=NOT_FOUND"
    },
    {
      "name": "session_create_after_lease_expiry",
      "status": "pass",
      "detail": "HTTP 201"
    },
    {
      "name": "session_delete_cleanup",
      "status": "pass",
      "detail": "HTTP 204"
    },
    {
      "name": "legacy_receiver_info_404",
      "status": "pass",
      "detail": "HTTP 404; error.code=NOT_FOUND"
    },
    {
      "name": "legacy_receiver_lite_volume_404",
      "status": "pass",
      "detail": "HTTP 404; error.code=NOT_FOUND"
    },
    {
      "name": "legacy_receiver_lite_info_404",
      "status": "pass",
      "detail": "HTTP 404; error.code=NOT_FOUND"
    },
    {
      "name": "legacy_receiver_lite_config_404",
      "status": "pass",
      "detail": "HTTP 404; error.code=NOT_FOUND"
    }
  ],
  "errors": [],
  "certified_by": "cristian",
  "certified_at": "2026-08-14T22:15:27Z"
}